Respondent ID,Collector ID,Start Date,End Date,Which CNCF Project are you contributing to/representing?,,,,,,,,,,,,,,,,,,,,,,,,,,,,,,,,,,,,,,,,,,,,,Where are you based (part of the world)?,"What is your feeling with respect to your overall experience with CNCF staff, where 10 is completely met expectations and 1 - did not meet expectations? *",Do you feel that CNCF reached out to collaborate and gather info about your needs? *,"Do you have a good understanding of the resources and programs available to you (i.e., CNCF Speakers Bureau, CNCF Swag Store)?",Efficiency: Did you feel that the CNCF team responded quickly to your requests? Where 10 is work was completed on time or ahead of schedule and 1 is delayed? *,How satisfied are you with the ambassador program?,"Any other feedback that you wish to share, from what CNCF can do more or what we should do less?"
,,,,Kubernetes,Prometheus,OpenTracing,Fluentd,CoreDNS,containerd,rkt,gRPC,Linkerd,CNI,Envoy,Jaeger,TUF (The Update Framework),Notary,Rook,Vitess,NATS,SPIFFE,SPIRE,Open Policy Agent,CloudEvents,Telepresence,Helm,Harbor,OpenMetrics,TiKV,Cortex,Buildpacks,Falco,Dragonfly,Virtual Kubelet,etcd,Brigade,KubeEdge,Network Service Mesh,OpenTelemetry,OpenEBS,Thanos,Flux,in-toto,Strimzi,KubeVirt,Longhorn,ChubaoFS,Other (please specify),Response,Response,Response,Response,Response,Response,Open-Ended Response
11441563642,254609041,03/24/2020 11:40:53 AM,03/24/2020 11:44:13 AM,Kubernetes,,,,,,,,,CNI,,,,,,,,,,,,,,,,,,,,,,,,,,,,,Flux,,,,,,,Europe,10,Yes,10,10,Neither satisfied nor dissatisfied,Always happy to talk in-person
11441225155,254609041,03/24/2020 7:14:41 AM,03/24/2020 7:18:09 AM,Kubernetes,,,,,,,,,,,,,,,,,,,,,,,,,,,,,,,,,,,,,,,,,,,,,Asia,10,Yes,9,10,Very satisfied,N/A
11440977891,254609041,03/24/2020 4:13:04 AM,03/24/2020 4:21:13 AM,Kubernetes,,,,,,,gRPC,,,Envoy,,,,,,NATS,,,,,,,,,,,,,,,,,,,,,,,,,,,,,Oceania,10,Yes,8,8,Very satisfied,Virtual meet-up support please.
11440962124,254609041,03/24/2020 4:04:12 AM,03/24/2020 4:10:20 AM,Kubernetes,Prometheus,,,,,,,,,,,,,,,,,,,,,Helm,,,,,,,,,,,,,,,,,,,,,,,Asia,8,Yes,8,9,Satisfied,Better planning for events in India.
11440859560,254609041,03/24/2020 3:04:10 AM,03/24/2020 3:07:00 AM,Kubernetes,Prometheus,,,,,,,,,,,,,,,,,,,,,,,,,,,,,,,,,,,,,,,,,,,,Europe,8,Yes,8,8,Satisfied,I am pretty happy overall
11440227052,254609041,03/23/2020 10:26:08 PM,03/23/2020 10:28:34 PM,Kubernetes,Prometheus,,,,containerd,,,Linkerd,CNI,,,,,,,NATS,,,,CloudEvents,,Helm,,,,,,,,,,,,,,,,Flux,,,,,,,Europe,7,No,7,6,Satisfied,"I'd like clearer guidelines about what kind of content is acceptable and more feedback on when it's not chosen for social media, to be more effective with limited time."
11440203123,254609041,03/23/2020 10:17:38 PM,03/23/2020 10:19:51 PM,Kubernetes,Prometheus,OpenTracing,Fluentd,,,,,,,,Jaeger,,,Rook,,,,,,,,Helm,,,,,,,,,,,,,,,,,,,KubeVirt,,,,North America,5,No,5,1,Satisfied,CNCF Ambassador seat on TOC would be nice
11436656089,254609041,03/20/2020 4:25:39 AM,03/22/2020 5:12:22 AM,Kubernetes,,,,,,,,,,,,,,,,,,,Open Policy Agent,,,,,,,,,,,,,,,,,,,,,,,,,,Asia,10,Yes,8,10,Very satisfied,"I was looking forward to meeting other CNCF ambassadors to discuss collaboration that we can have, unfortunately Kubecon got postponed. For my specific usecase, since I'm the only ambassador in the country and we have 4 meetup groups (more soon after virus), we need more swags. "
11435017670,254609041,03/21/2020 5:50:36 AM,03/21/2020 5:52:18 AM,Kubernetes,,,,,,,,,,,,,,,,,,,,,,,Harbor,,,,,,,,,,,,,,,,,,,,,,Oceania,9,Yes,10,10,Satisfied,APJ-specific TZ support
11423574232,254609041,03/17/2020 5:44:42 AM,03/17/2020 5:48:30 AM,Kubernetes,,,,,,,,,,,,,,,,,,,,,,,,,,,,,,,,,,,,,,,,,,,,,North America,9,Yes,10,10,Very satisfied,As of now with everything going on in the world everything you've done has been great.
11423200261,254609041,03/17/2020 1:49:58 AM,03/17/2020 1:53:59 AM,Kubernetes,Prometheus,,Fluentd,,,,,,,Envoy,,,,,,,,,Open Policy Agent,,,,,,,,,Falco,,,,,,,,OpenEBS,,,,,,,,,North America,10,Yes,10,10,Satisfied,"Cncf team done amazing work this year by adding credits, training, sending swag for ambassadors. It's very sad that kubecon had to be cancelled, hope we can organize it sooner later. Kcd program looks promising hopefully things work out well despite difficult year"
11422874453,254609041,03/16/2020 11:21:08 PM,03/16/2020 11:24:56 PM,Kubernetes,,,,,,,,,,,,,,,,,,,,,,,,,,,,,,,,,,,,,,,,,,,,,Europe,10,Yes,10,10,Satisfied,CNCF is doing good job :) keep up the good work :)
11422795833,254609041,03/16/2020 10:50:50 PM,03/16/2020 10:52:47 PM,Kubernetes,,,,,,,,,,,,,,,,,,,,,,Helm,,,,,,,,,,,,,,,,,,,,,,,North America,9,Yes,7,10,Satisfied,all good atm
11422661623,254609041,03/16/2020 10:04:04 PM,03/16/2020 10:05:21 PM,Kubernetes,,,,,,,,,,,,,,,,,,,,,,,,,,,,,,,,,,,,,,,,,,,,,North America,10,Yes,9,10,Very satisfied,/
11421353539,254609041,03/16/2020 1:08:28 PM,03/16/2020 1:10:17 PM,Kubernetes,,,,,,,,,,,,,,,,,,,,,,,,,,,,,,,,,,,,,,,,,,,,,Asia,10,Yes,10,10,Satisfied,Webinars would be great :)
11418267240,254609041,03/14/2020 10:18:23 AM,03/14/2020 10:26:36 AM,Kubernetes,,,,,,,,,,,,,,,,,,,Open Policy Agent,,,,,,,,,,,,,,,,,,,,,,,,,,Europe,10,No,8,10,Satisfied,"I’m very happy to be part of this program. I think we could think of a way to promote the program itself (not the ambassadors) so it would be recognizable without having to explain to people what it means. I would be proud to primarily identify, and present myself as cncf ambassador if it was widely known"
11418101225,254609041,03/14/2020 6:11:32 AM,03/14/2020 6:15:01 AM,,,,,,,,,,,,,,,,,,,,,,,,,,TiKV,,,,,,,,,,,,,,,,,,,,Asia,9,Yes,5,7,Satisfied,More guidance for the Asian ambassordors
11404647441,254609041,03/09/2020 7:38:49 PM,03/09/2020 7:44:30 PM,Kubernetes,,,,,,,,,,,,,,,,,,,,,,,,,,,,,,,,,,,,,,,,,,,,,Europe,10,Yes,7,10,Satisfied,--
11402934602,254609041,03/09/2020 6:45:43 AM,03/09/2020 6:47:11 AM,Kubernetes,,,,,,,,Linkerd,,,,,,,,,,,,,,,,,,,,,,,,,,,,OpenEBS,,,,,,,,,Asia,9,Yes,9,9,Satisfied,None
11400065748,254609041,03/07/2020 9:29:58 AM,03/07/2020 9:33:43 AM,Kubernetes,Prometheus,,,,,,,,,,,,,,,,SPIFFE,SPIRE,,,,,,,,,,,,,,,,,,,,,,,,,,,Asia,10,Yes,10,10,Very satisfied,None
11399593362,254609041,03/07/2020 2:32:59 AM,03/07/2020 2:36:03 AM,,Prometheus,,,,,,,,,,,,,,,,,,,,,,,,,,,,,,,,,,,,,,,,,,,,Europe,9,Yes,9,9,Satisfied,Keep up the great work!
11399521865,254609041,03/07/2020 1:47:16 AM,03/07/2020 1:50:01 AM,Kubernetes,,,,,,,,,,,,,,,,,,,,,,,,,,,,,,,,,,,,,,,,,,,,,North America,10,Yes,10,10,Very satisfied,Thank you for everything you're doing!
11398454679,254609041,03/06/2020 6:32:00 PM,03/06/2020 6:34:29 PM,Kubernetes,,,,,,,,,,,,,,,,,,,Open Policy Agent,,,Helm,,,,,,,,,,,,,,,,,,,,,,,Europe,9,Yes,8,9,Satisfied,all good
11398453571,254609041,03/06/2020 6:32:12 PM,03/06/2020 6:33:46 PM,Kubernetes,,,,,,,,,,,,,,,,,,,,,,,,,,,,,,,,,,,,,,,,,,,,,North America,10,Yes,10,10,Very satisfied,not at this time
11377015652,254609041,02/27/2020 9:02:55 PM,02/27/2020 9:07:48 PM,Kubernetes,Prometheus,,Fluentd,,,,gRPC,,,Envoy,,,,,,,,,,,,,,,,,,,,,,,,,,,,,,,,,,,Europe,10,Yes,10,9,Very satisfied,💙
11376573743,254609041,02/27/2020 6:19:07 PM,02/27/2020 6:38:49 PM,Kubernetes,,,,,,,,,,,,,,,,,,,,,,,,,,,,,,,,,,,,,,,,,,,,,Europe,10,Yes,6,9,Very satisfied,"Nope, thank you!"
11373958962,254609041,02/26/2020 9:46:52 PM,02/26/2020 9:49:27 PM,Kubernetes,,,,,,,,,,,,,,,,,,,,,,,,,,,,,,,,,,,,,,,,,,,,,Europe,8,Yes,10,8,Satisfied,-
11372202269,254609041,02/26/2020 10:27:39 AM,02/26/2020 10:29:42 AM,Kubernetes,,,,,,,,,,,,,,,,,,,,,,,,,,,,,,,,,,,,,,,,,,,,,Europe,7,No,7,8,Satisfied,none
11371929018,254609041,02/26/2020 7:06:14 AM,02/26/2020 7:07:13 AM,Kubernetes,,,,,,,,,,,,,,,,,,,,,,,,,,,,,,,,,,,,,,,,,,,,,Oceania,10,Yes,10,10,Satisfied,.
11371774557,254609041,02/26/2020 5:19:11 AM,02/26/2020 5:19:21 AM,Kubernetes,Prometheus,,,,,,,,,,,,,,,,,,,,,Helm,,,,,,,,,,,KubeEdge,,,,,,,,,,,,Asia,9,Yes,8,8,Satisfied,CNCF should encourage Ambassadors and experts to publish customer user stories or reference architectures. k8s adoption details are less in web compare to other technical details. Let there be a use case series of talks or blogs.
11371342925,254609041,02/26/2020 12:59:16 AM,02/26/2020 1:04:52 AM,Kubernetes,,,,,,,,,,,,,,,,,,,,CloudEvents,,,,,,,,,,,,,,,,,,,,,,,,,South America,10,Yes,10,10,Very satisfied,I am new on program so I need more experience for give a good opinion
11371253759,254609041,02/26/2020 12:21:27 AM,02/26/2020 12:24:57 AM,Kubernetes,,,,,,,,,,,,,,,,,,,,,,,,,,,,,,,,,,,,,,,,,,,,,North America,10,Yes,10,10,Very satisfied,everything is great!
11370717612,254609041,02/25/2020 9:05:39 PM,02/25/2020 9:07:23 PM,Kubernetes,Prometheus,,,,,,,,,,,,,,,,,,Open Policy Agent,,,,,,,,,,,,,,,,,,,,,,,,,,North America,8,Yes,8,8,Very satisfied,I would like to find more opportunities for ambassador involvement with the community.
11370693814,254609041,02/25/2020 8:56:50 PM,02/25/2020 8:59:13 PM,Kubernetes,,,,,,,,,,,,,,,,,,,,,,,Harbor,,,,,,,,,,,,,,,,,,,,,,South America,8,Yes,9,9,Very satisfied,None
11370153329,254609041,02/25/2020 6:01:57 PM,02/25/2020 6:04:55 PM,Kubernetes,,,,,,,,,,,,,,,,,,,,,,,,,,,,,,,,,,,,,,,,,,,,,Europe,9,No,6,10,Very satisfied,doing great
11370143561,254609041,02/25/2020 5:53:48 PM,02/25/2020 6:01:04 PM,,,,,,containerd,,,,,,,,,,,,,,,,,,,,,,,,,,,,,,,,,,,,,,,,North America,10,Yes,10,10,Very satisfied,nope; really enjoy being part of the program!
11370114561,254609041,02/25/2020 5:48:38 PM,02/25/2020 5:51:27 PM,Kubernetes,Prometheus,OpenTracing,Fluentd,,containerd,,,,,,,,Notary,,,,,,Open Policy Agent,,Telepresence,Helm,,,,,,Falco,,,,,,,OpenTelemetry,,,Flux,in-toto,,,,ChubaoFS,,Europe,8,Yes,9,10,Satisfied,"less king-maker, more grass root"
11370085259,254609041,02/25/2020 5:39:33 PM,02/25/2020 5:41:12 PM,Kubernetes,,,,,,,,,,,,,,,,,,,,,,,,,,,,,,,,,,,,,,,,,,,,,North America,9,Yes,10,10,Satisfied,None so far!
11370069713,254609041,02/25/2020 5:33:46 PM,02/25/2020 5:36:41 PM,Kubernetes,,,,,,,,,,,,,,,,,,,,,,,,,,,,,,,,,,,,,,,,,,,,Cloud Native community in generall,Europe,4,Yes,6,5,Neither satisfied nor dissatisfied,"You know, that whole Istio thing."
11369913838,254609041,02/25/2020 4:26:50 PM,02/25/2020 4:42:57 PM,Kubernetes,Prometheus,,,,,,,,,,,,,,,,,,,,,,,,,,,,,,,,,,,,,,,,,,,"influx, Rancher, k3s, Edge computing, security, grafana",Asia,10,Yes,7,10,Very satisfied,"When a new person joins the Ambassador program , they should be tols about the benefits apart from the regular email like how to apply for the speaker bureau, cloud accounts for meetups, one time swag stickers for meetups. Also CNCF should help in setting up the infra for video recording for  the meetups so that all meetups are live and recorded. Another point is setting up a schedule for beginner track for beginners and give that special focus meaning creating a schedule and posting it everywhere and encouraging beginners to go via that route to get the max out of the conference. Then have a fair opportunity to all  for kubernetes 101 and 201 full day trainings, have separate travel funding for CNCF ambassadors who have session at kubecon, Sendng out the notification of diversity scholorships and Travel funding little advance as VISA process take time. "
11369892197,254609041,02/25/2020 4:29:56 PM,02/25/2020 4:34:53 PM,Kubernetes,,,,,,,,,,,,,,,,,,,,,,Helm,,,,,,,,,,,,,,,,,,,,,,,North America,8,No,6,9,Satisfied,"More check-ins and proactively asking how help can be provided would be great! Also, more engagement to support CNCF projects in certain requests that help the community."
11369789491,254609041,02/25/2020 3:37:40 PM,02/25/2020 3:57:20 PM,Kubernetes,Prometheus,OpenTracing,,,,,,,,Envoy,Jaeger,,,,,,,,,CloudEvents,,,,,,,,,,,,,,,,,,,,Strimzi,KubeVirt,,,,North America,9,Yes,10,9,Very satisfied,Regional Forums gave great chances to catch up major topics in recent KubeCon as well as local user cases. Can we share the survey result of past forums to make it better for the next ones?
11369779389,254609041,02/25/2020 3:45:44 PM,02/25/2020 3:51:40 PM,Kubernetes,,,,,,,,,,Envoy,,,,,,,,,,,,,,,,,,,,,,,,,,,,,,,,,,,Asia,7,Yes,7,7,Neither satisfied nor dissatisfied,Gather community and spread knowledge
11369762673,254609041,02/25/2020 3:43:10 PM,02/25/2020 3:45:08 PM,Kubernetes,Prometheus,,,CoreDNS,containerd,,gRPC,,,,,,,,,,,,Open Policy Agent,,,,,,,,,,,,,,,,,,,,,,,,,,Europe,9,Yes,9,10,Very satisfied,No